{
  "schema_version": 1,
  "id": "syn_bff_hymn_tansy",
  "placeholder": true,
  "tag": "bff_hymn_tansy",
  "kind": "bff",
  "name_key": "syn.bff_hymn_tansy.name",
  "min_distance": 0,
  "max_distance": 2.5,
  "bonuses": [{"waifu": "waifu_hymn", "stat": "aura_radius", "op": "add", "value": 1}, {"waifu": "waifu_tansy", "stat": "slow_sec", "op": "add", "value": 1}],
  "guardian_bonus": {"stat": "shield_absorb", "op": "mult", "value": 0.25}
}
